{
  "registry_id": "structured_explanation_code_registry_v1",
  "registry_version": "structured_explanation_code_registry_v1",
  "canonical_dimension_registry_version": "canonical_dimension_registry_v1",
  "status": "provisional",
  "production_approval_status": "not_approved",
  "codes": [
    {
      "explanation_code": "overall_status_complete",
      "category": "overall_status",
      "polarity": "neutral",
      "default_localization_key": "qmatch.explanation.overall.complete",
      "allowed_source_types": ["aggregation"],
      "required_parameters": ["status_code"],
      "optional_parameters": ["normalized_score", "confidence"],
      "blocking_eligibility": false,
      "privacy_level": "public",
      "production_status": "not_approved",
      "description": "Overall evaluation status is complete.",
      "prohibited_interpretations": ["relationship_success_prediction"]
    },
    {
      "explanation_code": "overall_status_partial",
      "category": "overall_status",
      "polarity": "cautionary",
      "default_localization_key": "qmatch.explanation.overall.partial",
      "allowed_source_types": ["aggregation"],
      "required_parameters": ["status_code"],
      "optional_parameters": ["count"],
      "blocking_eligibility": false,
      "privacy_level": "public",
      "production_status": "not_approved",
      "description": "Overall evaluation status is partial.",
      "prohibited_interpretations": ["relationship_success_prediction"]
    },
    {
      "explanation_code": "overall_status_insufficient",
      "category": "overall_status",
      "polarity": "unavailable",
      "default_localization_key": "qmatch.explanation.overall.insufficient",
      "allowed_source_types": ["aggregation", "evidence_coverage"],
      "required_parameters": ["status_code"],
      "optional_parameters": ["count"],
      "blocking_eligibility": false,
      "privacy_level": "public",
      "production_status": "not_approved",
      "description": "Insufficient evidence for overall scores.",
      "prohibited_interpretations": ["fabricated_neutral_score"]
    },
    {
      "explanation_code": "overall_status_blocked",
      "category": "overall_status",
      "polarity": "blocking",
      "default_localization_key": "qmatch.explanation.overall.blocked",
      "allowed_source_types": ["aggregation", "hard_constraint"],
      "required_parameters": ["status_code"],
      "optional_parameters": [],
      "blocking_eligibility": true,
      "privacy_level": "public",
      "production_status": "not_approved",
      "description": "Overall result blocked by hard constraint.",
      "prohibited_interpretations": ["numeric_failure_score"]
    },
    {
      "explanation_code": "overall_status_invalid",
      "category": "overall_status",
      "polarity": "unavailable",
      "default_localization_key": "qmatch.explanation.overall.invalid",
      "allowed_source_types": ["aggregation"],
      "required_parameters": ["status_code"],
      "optional_parameters": [],
      "blocking_eligibility": false,
      "privacy_level": "public",
      "production_status": "not_approved",
      "description": "Overall evaluation input was invalid.",
      "prohibited_interpretations": ["relationship_success_prediction"]
    },
    {
      "explanation_code": "structural_dimension_close",
      "category": "strong_alignment",
      "polarity": "supportive",
      "default_localization_key": "qmatch.explanation.structural.close",
      "allowed_source_types": ["structural_iq", "structural_eq", "structural_frequency"],
      "required_parameters": ["dimension_id", "module_id", "normalized_score", "confidence"],
      "optional_parameters": ["confidence_band"],
      "blocking_eligibility": false,
      "privacy_level": "public",
      "production_status": "not_approved",
      "description": "Trusted close structural dimension.",
      "prohibited_interpretations": ["intelligence_superiority", "emotional_health", "maturity"]
    },
    {
      "explanation_code": "structural_dimension_different",
      "category": "measured_difference",
      "polarity": "cautionary",
      "default_localization_key": "qmatch.explanation.structural.different",
      "allowed_source_types": ["structural_iq", "structural_eq", "structural_frequency"],
      "required_parameters": ["dimension_id", "module_id", "normalized_score", "confidence"],
      "optional_parameters": ["confidence_band"],
      "blocking_eligibility": false,
      "privacy_level": "public",
      "production_status": "not_approved",
      "description": "Trusted distant structural dimension.",
      "prohibited_interpretations": ["relationship_unfitness", "personal_deficiency"]
    },
    {
      "explanation_code": "structural_dimension_close_low_confidence",
      "category": "strong_alignment",
      "polarity": "supportive",
      "default_localization_key": "qmatch.explanation.structural.close",
      "allowed_source_types": ["structural_iq", "structural_eq", "structural_frequency"],
      "required_parameters": ["dimension_id", "module_id", "confidence", "confidence_band"],
      "optional_parameters": ["normalized_score"],
      "blocking_eligibility": false,
      "privacy_level": "public",
      "production_status": "not_approved",
      "description": "Close structural dimension with low evidence confidence.",
      "prohibited_interpretations": ["certainty_of_alignment"]
    },
    {
      "explanation_code": "structural_dimension_different_low_confidence",
      "category": "measured_difference",
      "polarity": "cautionary",
      "default_localization_key": "qmatch.explanation.structural.different",
      "allowed_source_types": ["structural_iq", "structural_eq", "structural_frequency"],
      "required_parameters": ["dimension_id", "module_id", "confidence", "confidence_band"],
      "optional_parameters": ["normalized_score"],
      "blocking_eligibility": false,
      "privacy_level": "public",
      "production_status": "not_approved",
      "description": "Distant structural dimension with low evidence confidence.",
      "prohibited_interpretations": ["certainty_of_conflict"]
    },
    {
      "explanation_code": "structural_module_high_coverage",
      "category": "evidence_limitation",
      "polarity": "neutral",
      "default_localization_key": "qmatch.explanation.evidence.module_coverage",
      "allowed_source_types": ["structural_iq", "structural_eq", "structural_frequency", "evidence_coverage"],
      "required_parameters": ["module_id", "normalized_score"],
      "optional_parameters": ["count"],
      "blocking_eligibility": false,
      "privacy_level": "public",
      "production_status": "not_approved",
      "description": "Structural module has high coverage.",
      "prohibited_interpretations": []
    },
    {
      "explanation_code": "structural_module_partial_coverage",
      "category": "evidence_limitation",
      "polarity": "cautionary",
      "default_localization_key": "qmatch.explanation.evidence.module_partial",
      "allowed_source_types": ["structural_iq", "structural_eq", "structural_frequency", "evidence_coverage"],
      "required_parameters": ["module_id", "normalized_score"],
      "optional_parameters": ["count"],
      "blocking_eligibility": false,
      "privacy_level": "public",
      "production_status": "not_approved",
      "description": "Structural module has partial coverage.",
      "prohibited_interpretations": ["low_compatibility"]
    },
    {
      "explanation_code": "structural_module_insufficient",
      "category": "evidence_limitation",
      "polarity": "unavailable",
      "default_localization_key": "qmatch.explanation.evidence.module_insufficient",
      "allowed_source_types": ["structural_iq", "structural_eq", "structural_frequency", "evidence_coverage"],
      "required_parameters": ["module_id", "status_code"],
      "optional_parameters": [],
      "blocking_eligibility": false,
      "privacy_level": "public",
      "production_status": "not_approved",
      "description": "Structural module insufficient for scoring.",
      "prohibited_interpretations": ["low_compatibility"]
    },
    {
      "explanation_code": "structural_dimension_excluded",
      "category": "missing_information",
      "polarity": "unavailable",
      "default_localization_key": "qmatch.explanation.evidence.dimension_excluded",
      "allowed_source_types": ["structural_iq", "structural_eq", "structural_frequency", "evidence_coverage"],
      "required_parameters": ["dimension_id", "module_id", "status_code"],
      "optional_parameters": [],
      "blocking_eligibility": false,
      "privacy_level": "public",
      "production_status": "not_approved",
      "description": "Structural dimension excluded from comparison.",
      "prohibited_interpretations": ["imputed_score"]
    },
    {
      "explanation_code": "partner_preference_strongly_satisfied",
      "category": "partner_preference_fit",
      "polarity": "supportive",
      "default_localization_key": "qmatch.explanation.preference.strong_fit",
      "allowed_source_types": ["partner_preference"],
      "required_parameters": ["dimension_id", "direction", "normalized_score", "confidence"],
      "optional_parameters": ["module_id"],
      "blocking_eligibility": false,
      "privacy_level": "public",
      "production_status": "not_approved",
      "description": "Explicit partner preference strongly satisfied.",
      "prohibited_interpretations": ["should_change_self"]
    },
    {
      "explanation_code": "partner_preference_partially_satisfied",
      "category": "partner_preference_fit",
      "polarity": "neutral",
      "default_localization_key": "qmatch.explanation.preference.partial_fit",
      "allowed_source_types": ["partner_preference"],
      "required_parameters": ["dimension_id", "direction", "normalized_score"],
      "optional_parameters": ["confidence"],
      "blocking_eligibility": false,
      "privacy_level": "public",